adult,belongs_to_collection,budget,genres,homepage,id,imdb_id,original_language,original_title,overview,popularity,poster_path,production_companies,production_countries,release_date,revenue,runtime,spoken_languages,status,tagline,title,video,vote_average,vote_count
False,"{'id': 10194, 'name': 'Toy Story Collection', 'poster_path': '/7G9915LfUQ2lVfwMEEhDsn3kT4B.jpg', 'backdrop_path': '/9FBwqcd9IRruEDUrTdcaafOMKUq.jpg'}",30000000,"[{'id': 16, 'name': 'Animation'}, {'id': 35, 'name': 'Comedy'}, {'id': 10751, 'name': 'Family'}]",http://toystory.disney.com/toy-story,862,tt0114709,en,Toy Story,"Led by Woody, Andy's toys live happily in his room until Andy's birthday brings Buzz Lightyear onto the scene. Afraid of losing his place in Andy's heart, Woody plots against Buzz. But when circumstances separate Buzz and Woody from their owner, the duo eventually learns to put aside their differences.",21.946943,/rhIRbceoE9lR4veEXuwCC2wARtG.jpg,"[{'name': 'Pixar Animation Studios', 'id': 3}]","[{'iso_3166_1': 'US', 'name': 'United States of America'}]",1995-10-30,373554033,81.0,"[{'iso_639_1': 'en', 'name': 'English'}]",Released,,Toy Story,False,7.7,5415
False,,65000000,"[{'id': 12, 'name': 'Adventure'}, {'id': 14, 'name': 'Fantasy'}, {'id': 10751, 'name': 'Family'}]",,8844,tt0113497,en,Jumanji,"When siblings Judy and Peter discover an enchanted board game that opens the door to a magical world, they unwittingly invite Alan -- an adult who's been trapped inside the game for 26 years -- into their living room. Alan's only hope for freedom is to finish the game, which proves risky as all three find themselves running from giant rhinoceroses, evil monkeys and other terrifying creatures.",17.015539,/vzmL6fP7aPKNKPRTFnZmiUfciyV.jpg,"[{'name': 'TriStar Pictures', 'id': 559}, {'name': 'Teitler Film', 'id': 2550}, {'name': 'Interscope Communications', 'id': 10201}]","[{'iso_3166_1': 'US', 'name': 'United States of America'}]",1995-12-15,262797249,104.0,"[{'iso_639_1': 'en', 'name': 'English'}, {'iso_639_1': 'fr', 'name': 'Français'}]",Released,Roll the dice and unleash the excitement!,Jumanji,False,6.9,2413
False,"{'id': 119050, 'name': 'Grumpy Old Men Collection', 'poster_path': '/nLvUdqgPgm3F85NMCii9gVFUcet.jpg', 'backdrop_path': '/hypTnLot2z8wpFS7qwsQHW1uV8u.jpg'}",0,"[{'id': 10749, 'name': 'Romance'}, {'id': 35, 'name': 'Comedy'}]",,15602,tt0113228,en,Grumpier Old Men,"A family wedding reignites the ancient feud between next-door neighbors and fishing buddies John and Max. Meanwhile, a sultry Italian divorcée opens a restaurant at the local bait shop, alarming the locals who worry she'll scare the fish away. But she's less interested in seafood than she is in cooking up a hot time with Max.",11.7129,/6ksm1sjKMFLbO7UY2i6G1ju9SML.jpg,"[{'name': 'Warner Bros.', 'id': 6194}, {'name': 'Lancaster Gate', 'id': 19464}]","[{'iso_3166_1': 'US', 'name': 'United States of America'}]",1995-12-22,0,101.0,"[{'iso_639_1': 'en', 'name': 'English'}]",Released,Still Yelling. Still Fighting. Still Ready for Love.,Grumpier Old Men,False,6.5,92
False,,35000000,"[{'id': 28, 'name': 'Action'}, {'id': 12, 'name': 'Adventure'}, {'id': 53, 'name': 'Thriller'}]",,9091,tt0114576,en,Sudden Death,"International action superstar Jean Claude Van Damme teams with Powers Boothe in a Tension-packed, suspense thriller, set against the back-drop of a Stanley Cup game.Van Damme portrays a father whose daughter is suddenly taken during a championship hockey game. With the captors demanding a billion dollars by game's end, Van Damme frantically sets a plan in motion to rescue his daughter and abort an impending explosion before the final buzzer...",5.23158,/eoWvKD60lT95Ss1MYNgVExpo5iU.jpg,"[{'name': 'Universal Pictures', 'id': 33}, {'name': 'Imperial Entertainment', 'id': 21437}, {'name': 'Signature Entertainment', 'id': 23770}]","[{'iso_3166_1': 'US', 'name': 'United States of America'}]",1995-12-22,64350171,106.0,"[{'iso_639_1': 'en', 'name': 'English'}]",Released,Terror goes into overtime.,Sudden Death,False,5.5,174
False,"{'id': 10194, 'name': 'Toy Story Collection', 'poster_path': '/7G9915LfUQ2lVfwMEEhDsn3kT4B.jpg', 'backdrop_path': '/9FBwqcd9IRruEDUrTdcaafOMKUq.jpg'}",90000000,"[{'id': 16, 'name': 'Animation'}, {'id': 35, 'name': 'Comedy'}, {'id': 10751, 'name': 'Family'}]",http://toystory.disney.com/toy-story-2,863,tt0120363,en,Toy Story 2,"Andy heads off to Cowboy Camp, leaving his toys to their own devices. Things shift into high gear when an obsessive toy collector named Al McWhiggen, owner of Al's Toy Barn kidnaps Woody. Andy's toys mount a daring rescue mission, Buzz Lightyear meets his match and Woody has to decide where he and his heart truly belong.",17.547693,/3CmK3XurcLeUyMifCR28ibzupbB.jpg,"[{'name': 'Pixar Animation Studios', 'id': 3}]","[{'iso_3166_1': 'US', 'name': 'United States of America'}]",1999-10-30,497366869,92.0,"[{'iso_639_1': 'en', 'name': 'English'}]",Released,The toys are back!,Toy Story 2,False,7.3,3914
